{
  "schema_version": "gamlike/v1",
  "_meta": {
    "source_file": "<SCRUBBED>",
    "parser_version": "0.1.0",
    "maddm_version": "3.2",
    "parsed_at": "<SCRUBBED>"
  },
  "relic": {
    "present": true,
    "Omegah2": 0.06,
    "Omegah_Planck": 0.12,
    "xsi": 0.5,
    "x_f": 25.0,
    "sigmav_xf": 8.42e-27,
    "initial_states": [
      "chichibar"
    ],
    "channels": {
      "chichibar": {
        "bbx": 85.0,
        "ttx": 10.0,
        "wphm": 5.0
      }
    },
    "channels_sum_pct": 100.0
  },
  "direct": {
    "present": true,
    "results": [
      {
        "name": "Xenon1T_2018_SI",
        "experiment_label": "XENON1T 2018 (SI)",
        "sig_cm2": 1.23e-45,
        "lim_cm2": 3.4e-46
      },
      {
        "name": "Xenon1T_2018_SD_neutron",
        "experiment_label": "XENON1T 2018 (SD)",
        "sig_cm2": 5.5e-42,
        "lim_cm2": 5.67e-42
      }
    ],
    "sigma_si_proton_cm2": null,
    "sigma_si_neutron_cm2": null,
    "sigma_sd_proton_cm2": null,
    "sigma_sd_neutron_cm2": null,
    "lim_si_proton_cm2": null,
    "lim_si_neutron_cm2": null,
    "lim_sd_proton_cm2": null,
    "lim_sd_neutron_cm2": null
  },
  "indirect": {
    "present": true,
    "sigmav_method": "madevent",
    "continuum": {
      "present": true,
      "channels": {
        "chichibar_bbx": {
          "sigmav": 1.99e-26,
          "limit": 3e-25
        },
        "chichibar_ttx": {
          "sigmav": 2.34e-27,
          "limit": 3e-25
        }
      }
    },
    "lines": {
      "present": true,
      "channels": {
        "chichibar_za": {
          "sigmav": 1.2e-30,
          "limit": 2.3e-29
        }
      }
    },
    "global": {
      "flux_method": "pythia8",
      "Total_xsec": 2.34e-26,
      "TotalSM_xsec": null,
      "Fermi_Likelihood": -12.3,
      "Fermi_pvalue": 0.045,
      "Fermi_Likelihood_Thermal": -8.7,
      "Fermi_pvalue_Thermal": 0.123,
      "thermal_emitted": true
    }
  },
  "spectral": {
    "present": false,
    "experiments": []
  },
  "fluxes_source": {
    "present": false,
    "method": null,
    "fluxes": {
      "neutrinos_e": null,
      "neutrinos_mu": null,
      "neutrinos_tau": null,
      "gammas": null,
      "positrons": null
    }
  },
  "warnings": []
}
