{
  "schema_version": "gamlike/v1",
  "_meta": {
    "source_file": "<SCRUBBED>",
    "parser_version": "0.1.0",
    "maddm_version": "3.2",
    "parsed_at": "<SCRUBBED>"
  },
  "relic": {
    "present": true,
    "Omegah2": 0.12,
    "Omegah_Planck": 0.12,
    "xsi": 1.0,
    "x_f": 25.0,
    "sigmav_xf": 4.21e-27,
    "initial_states": [
      "chichibar"
    ],
    "channels": {
      "chichibar": {
        "za": 100.0
      }
    },
    "channels_sum_pct": 100.0
  },
  "direct": {
    "present": false,
    "results": []
  },
  "indirect": {
    "present": true,
    "sigmav_method": "madevent",
    "continuum": {
      "present": false,
      "channels": {}
    },
    "lines": {
      "present": true,
      "channels": {
        "chichibar_za": {
          "sigmav": 1.2e-30,
          "limit": 2.3e-29
        }
      }
    },
    "global": {
      "flux_method": "pythia8",
      "Total_xsec": 1.2e-30,
      "TotalSM_xsec": null,
      "Fermi_Likelihood": -5.6,
      "Fermi_pvalue": 0.21,
      "Fermi_Likelihood_Thermal": null,
      "Fermi_pvalue_Thermal": null,
      "thermal_emitted": false
    }
  },
  "spectral": {
    "present": true,
    "experiments": [
      {
        "experiment_name": "Fermi_LAT_2015",
        "arxiv_number": "1503.02641",
        "ROI": 0.5,
        "Jfactor": 1.2e+23,
        "astrophysical_parameters": null,
        "no_peaks_out_of_range": true,
        "peaks": []
      }
    ]
  },
  "fluxes_source": {
    "present": false,
    "method": null,
    "fluxes": {
      "neutrinos_e": null,
      "neutrinos_mu": null,
      "neutrinos_tau": null,
      "gammas": null,
      "positrons": null
    }
  },
  "warnings": [
    {
      "code": "NO_PEAKS_OUT_OF_DETECTION_RANGE",
      "field": "spectral.Fermi_LAT_2015.peaks",
      "reason": "No peaks found out of detection range for experiment 'Fermi_LAT_2015' (G16).",
      "source_ref": "maddm_run_interface.py:3590-3595"
    },
    {
      "code": "FIELD_GATED",
      "field": "indirect.global.Fermi_Likelihood_Thermal",
      "reason": "xsi >= 1 (xsi_value=1.00e+00); MadDM does not emit thermal-rescaled likelihood",
      "source_ref": "maddm_run_interface.py:3572-3574"
    },
    {
      "code": "FIELD_GATED",
      "field": "indirect.global.Fermi_pvalue_Thermal",
      "reason": "xsi >= 1 (xsi_value=1.00e+00); MadDM does not emit thermal-rescaled p-value",
      "source_ref": "maddm_run_interface.py:3572-3574"
    }
  ]
}
