{
  "schema_version": "gamlike/v1",
  "_meta": {
    "source_file": "<SCRUBBED>",
    "parser_version": "0.1.0",
    "maddm_version": "3.2",
    "parsed_at": "<SCRUBBED>"
  },
  "relic": {
    "present": false,
    "Omegah2": null,
    "Omegah_Planck": null,
    "xsi": null,
    "x_f": null,
    "sigmav_xf": null,
    "initial_states": [],
    "channels": {},
    "channels_sum_pct": null
  },
  "direct": {
    "present": true,
    "results": [
      {
        "name": "SigmaN_SI_p",
        "experiment_label": "Xenon1ton",
        "sig_cm2": 7.69e-45,
        "lim_cm2": 1.17e-46
      },
      {
        "name": "SigmaN_SI_n",
        "experiment_label": "Xenon1ton",
        "sig_cm2": 7.79e-45,
        "lim_cm2": 1.17e-46
      },
      {
        "name": "SigmaN_SD_p",
        "experiment_label": "Pico60",
        "sig_cm2": 5.19e-40,
        "lim_cm2": 6.52e-41
      },
      {
        "name": "SigmaN_SD_n",
        "experiment_label": "Lux2017",
        "sig_cm2": 3.95e-40,
        "lim_cm2": 3.56e-41
      }
    ],
    "sigma_si_proton_cm2": 7.69e-45,
    "sigma_si_neutron_cm2": 7.79e-45,
    "sigma_sd_proton_cm2": 5.19e-40,
    "sigma_sd_neutron_cm2": 3.95e-40,
    "lim_si_proton_cm2": 1.17e-46,
    "lim_si_neutron_cm2": 1.17e-46,
    "lim_sd_proton_cm2": 6.52e-41,
    "lim_sd_neutron_cm2": 3.56e-41
  },
  "indirect": {
    "present": false,
    "sigmav_method": null,
    "continuum": {
      "present": false,
      "channels": {}
    },
    "lines": {
      "present": false,
      "channels": {}
    },
    "global": {
      "flux_method": null,
      "Total_xsec": null,
      "TotalSM_xsec": null,
      "Fermi_Likelihood": null,
      "Fermi_pvalue": null,
      "Fermi_Likelihood_Thermal": null,
      "Fermi_pvalue_Thermal": null,
      "thermal_emitted": false
    }
  },
  "spectral": {
    "present": false,
    "experiments": []
  },
  "fluxes_source": {
    "present": false,
    "method": null,
    "fluxes": {
      "neutrinos_e": null,
      "neutrinos_mu": null,
      "neutrinos_tau": null,
      "gammas": null,
      "positrons": null
    }
  },
  "warnings": []
}
